id,product_id,title,review
1,1080,,"Love this dress!  it's sooo pretty.  i happened to find it in a store, and i'm glad i did bc i never would have ordered it online bc it's petite.  i bought a petite and am 5'8"".  i love the length on me- hits just a little below the knee.  would definitely be a true midi on someone who is truly petite."
2,1077,Some major design flaws,"I had such high hopes for this dress and really wanted it to work for me. i initially ordered the petite small (my usual size) but i found this to be outrageously small. so small in fact that i could not zip it up! i reordered it in petite medium, which was just ok. overall, the top half was comfortable and fit nicely, but the bottom half had a very tight under layer and several somewhat cheap (net) over layers. imo, a major design flaw was the net over layer sewn directly into the zipper - it c"
3,1049,My favorite buy!,"I love, love, love this jumpsuit. it's fun, flirty, and fabulous! every time i wear it, i get nothing but great compliments!"
4,847,Flattering shirt,"This shirt is very flattering to all due to the adjustable front tie. it is the perfect length to wear with leggings and it is sleeveless so it pairs well with any cardigan. love this shirt!!!"
5,1080,Not for the very petite,"I love tracy reese dresses, but this one is not for the very petite. i am just under 5 feet tall and usually wear a 0p in this brand. this dress was very pretty out of the package but its a lot of dress. the skirt is long and very full so it overwhelmed my small frame. not a stranger to alterations, shortening and narrowing the skirt would take away from the embellishment of the garment. i love the color and the idea of the style but it just did not work on me. i returned this dress."
6,858,Cagrcoal shimmer fun,"I aded this in my basket at hte last mintue to see what it would look like in person. (store pick up). i went with teh darkler color only because i am so pale :-) hte color is really gorgeous, and turns out it mathced everythiing i was trying on with it prefectly. it is a little baggy on me and hte xs is hte msallet size (bummer, no petite). i decided to jkeep it though, because as i said, it matvehd everything. my ejans, pants, and the 3 skirts i waas trying on (of which i ]kept all ) oops."
7,858,"Shimmer, surprisingly goes with lots","I ordered this in carbon for store pick up, and had a ton of stuff (as always) to try on and used this top to pair (skirts and pants). everything went with it. the color is really nice charcoal with shimmer, and went well with pencil skirts, flare pants, etc. my only compaint is it is a bit big, sleeves are long and it doesn't go in petite. also a bit loose for me, but no xxs... so i kept it and wil ldecide later since the light color is already sold out in hte smallest size..."
8,1077,Flattering,"I love this dress. i usually get an xs but it runs a little snug in bust so i ordered up a size. very flattering and feminine with the usual retailer flair for style."
9,1077,Such a fun dress!,"I'm 5""5' and 125 lbs. i ordered the s petite to make sure the length wasn't too long. i typically wear an xs regular in retailer dresses. if you're less busty (34b cup or smaller), a s petite will fit you perfectly (snug, but not tight). i love that i could dress it up for a party, or down for work. i love that the tulle is longer then the fabric underneath."
10,1077,Dress looks like it's made of cheap material,"Dress runs small esp where the zipper area runs. i ordered the sp which typically fits me and it was very tight! the material on the top looks and feels very cheap that even just pulling on it will cause it to rip the fabric. pretty disappointed as it was going to be my christmas dress this year! needless to say it will be going back."
11,1095,,"This dress is perfection! so pretty and flattering."
12,1095,Perfect!!!,"More and more i find myself reliant on the reviews written by savvy shoppers before me and for the most past, they are right on in their estimation of the product. in the case of this dress-if it had not been for the reveiws-i doubt i would have even tried this. the dress is beautifully made, lined and reminiscent of the old retailer quality. it is lined in the solid periwinkle-colored fabric that matches the outer fabric print. tts and very form-fitting. falls just above the knee and does not rid"
13,767,Runs big,"Bought the black xs to go under the larkspur midi dress because they didn't bother lining the skirt portion (grrrrrrrrrrr).my stats are 34a-28/29-36 and the xs fit very smoothly around the chest and was flowy around my lower half, so i would say it's running big.the straps are very pretty and it could easily be nightwear too.i'm 5'6"" and it came to just below my knees."
14,1077,Pretty party dress with some issues,"This is a nice choice for holiday gatherings. i like that the length grazes the knee so it is conservative enough for office related gatherings. the size small fit me well - i am usually a size 2/4 with a small bust. in my opinion it runs small and those with larger busts will definitely have to size up (but then perhaps the waist will be too big). the problem with this dress is the quality. the fabrics are terrible. the delicate netting type fabric on the top layer of skirt got stuck in the zip"
15,1065,"Nice, but not for my body","I took these out of the package and wanted them to fit so badly, but i could tell before i put them on that they wouldn't. these are for an hour-glass figure. i am more straight up and down. the waist was way too small for my body shape and even if i sized up, i could tell they would still be tight in the waist and too roomy in the hips - for me. that said, they are really nice. sturdy, linen-like fabric, pretty color, well made. i hope they make someone very happy!"
16,1065,"You need to be at least average height, or taller","Material and color is nice.  the leg opening is very large.  i am 5'1 (100#) and the length hits me right above my ankle.  with a leg opening the size of my waist and hem line above my ankle, and front pleats to make me fluffy, i think you can imagine that it is not a flattering look.  if you are at least average height or taller, this may look good on you."
17,853,Looks great with white pants,"Took a chance on this blouse and so glad i did. i wasn't crazy about how the blouse is photographed on the model. i paired it whit white pants and it worked perfectly. crisp and clean is how i would describe it. launders well. fits great. drape is perfect. wear tucked in or out - can't go wrong."
18,1120,Super cute and cozy,"A flattering, super cozy coat.  will work well for cold, dry days and will look good with jeans or a dressier outfit.  i am 5' 5'', about 135 and the small fits great."
19,1077,Stylish and comfortable,"I love the look and feel of this tulle dress. i was looking for something different, but not over the top for new year's eve. i'm small chested and the top of this dress is form fitting for a flattering look. once i steamed the tulle, it was perfect! i ordered an xsp. length was perfect too."
20,847,"Cute, crisp shirt","If this product was in petite, i would get the petite. the regular is a little long on me but a tailor can do a simple fix on that. fits nicely! i'm 5'4, 130lb and pregnant so i bough t medium to grow into. the tie can be front or back so provides for some nice flexibility on form fitting."
21,1080,I'm torn!,"I'm upset because for the price of the dress, i thought it was embroidered! no, that is a print on the fabric. i think i cried a little when i opened the box. it is still ver pretty. i would say it is true to size, it is a tad bit big on me, but i am very tiny, but i can still get away with it. the color is vibrant. the style is unique. skirt portion is pretty poofy. i keep going back and forth on it mainly because of the price, although the quality is definitely there. except i wish it were emb"
22,1077,Not what it looks like,"First of all, this is not pullover styling. there is a side zipper. i wouldn't have purchased it if i knew there was a side zipper because i have a large bust and side zippers are next to impossible for me.second of all, the tulle feels and looks cheap and the slip has an awkward tight shape underneath.not at all what is looks like or is described as. sadly will be returning, but i'm sure i will find something to exchange it for!"
23,1077,"Like it, but don't love it.","Cute little dress fits tts. it is a little high waisted. good length for my 5'9 height. i like the dress, i'm just not in love with it. i dont think it looks or feels cheap. it appears just as pictured."
24,847,Versatile,"I love this shirt because when i first saw it, i wasn't sure if it was a shirt or dress. since it is see-through if you wear it like a dress you will need a slip or wear it with leggings. i bought a slip, wore the tie in the back, and rocked it with white wedges. you could also wear it as a vest. be careful with the buttons. i haven't had any fall off yet, but i feel like they will. overall it's great for any occasion and it's fun to wear!"
25,697,Falls flat,"Loved the material, but i didnt really look at how long the dress was before i purchased both a large and a medium. im 5'5"" and there was atleast 5"" of material at my feet. the gaps in the front are much wider than they look. felt like the dress just fell flat. both were returned. im usually a large and the med fit better. 36d 30 in jeans"
26,949,Huge disappointment,"I have been waiting for this sweater coat to ship for weeks and i was so excited for it to arrive. this coat is not true to size and made me look short and squat. the sleeves are very wide (although long). as a light weight fall coat the sleeves don't need to be as wide because you wouldn't be layerng too much underneath. the buttons need to be moved at least three inches in for a nicer fit. i thought about redoing the buttons myself but the sleeves looked even more out of proportion with a tigh"
27,1003,"Loved, but returned","The colors weren't what i expected either. the dark blue is much more vibrant and i just couldn't find anything to really go with it. fabric is thick and good quality. has nice weight and movement to it. the skirt just wasn't for me, in the end."
28,684,Great shirt!!!,"I have several of goodhyouman shirts and i get so many compliments on them. especially the one that says forehead kisses are underrated. don't hesitate. buy this shirt. you won't be sorry....."
29,4,Great layering piece,"This sweater is so comfy and classic - it balances a quirky hand-knit look with a beautiful color and practical fit. it is a bit cropped and boxy as part of the style, and as others mentioned, there are gaps in the knit that make it see-through. in my opinion this makes it perfect for layering! i like having a longer camisole showing underneath, or wearing it over a little dress. it's warm but still thin enough to fit under a jacket or coat."
30,1060,,"Beautifully made pants and on trend with the flared crop. so much cuter in person. love these!"
31,1060,Cuter in oerson!,"I never would have given these pants a second look online, in person they are much cuter! the stripes are brighter and the fit more flattering. the crop has a cute flare which is right on trend. this brand has always run small for me, i am 5'8 about 140lbs and carry some chubbiness in the belly. i paired it with a collarless loose navy blazer"
32,1060,Love these pants,"These pants are even better in person. the only downside is that they need to be dry cleaned."
33,949,Mehh,"I ordered this 3 months ago, and it finally came off back order. a huge disappointment. the fit wasn&#39;t so much the issue for me. the quality of the wool is subpar. someone else mentioned a &quot;felted wool&quot;...i guess, is that what you call it?  it does literally feel like felt! super thin, itchy, doesn&#39;t drape very well, and feels cheap (made in china). i got it on sale, but still not worth what i paid. definitely going back."
34,697,Love this dress!,"This is such a neat dress. the color is great and the fabric is super soft. i am tall so the long length was an added bonus. it definitely needs something underneath since the front gaps. i am going to pair it with a funky tank top, necklaces and boots. super cute!!"
35,1060,Lovely!,"Wouldn't have given them a second look but tried them on in store of a whim. love, love!!"
36,1002,,"This is a comfortable skirt that can span seasons easily. while not the most exciting design, it is a good work skirt that can be paired with many tops."
37,949,Beautifully cut lightweight coat,"Just ordered this in a small for me (5'6"", 135, size 4) and medium for my mom (5'3"", 130, size 8) and it is gorgeous - beautifully draped, all the weight/warmth i'll need for houston fall and winter, looks polished snapped or unsnapped. age-appropriate for both my mom (60's) and myself (30's). will look amazing with skinny jeans or leggings. we ordered the gray which is true to the photos."
38,684,,"Super cute and comfy pull over. sizing is accurate. material has a little bit of stretch."
39,862,,"Great casual top with flare. looks cute with grey pilcro stet jeans. flattering with peplum in back. nice cut for shoulders and neckline."
40,862,,"Pretty and unique. great with jeans or i have worn it to work with slacks and heels. the colors, print, and embroidery are lovely. reasonably priced!"
41,862,,"This is a beautiful top. it's unique and not so ordinary. i bought my usual medium and i found that it fits tight across my chest. although i had a baby this year and i am nursing, so that could be why. if i bought again i would size up."
42,910,Soft & lovely,"This poncho is so cute i love the plaid check design, the colors look like sorbet & cream and it will pair well with a turtleneck and jeans or pencil skirt and heels. i love this look for fall and it can roll right into spring. great buy!!"
43,89,Some things you should know...,"First, this is thermal ,so naturally i didn't expect super sheer, but it is. really sheer light fabric. i like it, but be prepared for considering who you might run into if you walk around the house in it. second, it is large. i ordered the size 0 and it's a nice oversized fit for my 5'3"" 125 pounds. i wouldn't want to go larger. along with being sheer, the fabric is easily stretched, which i don't mind in this case. finally, the color. it looks white on my monitor and shows a colorful blue dot"
44,862,Beautiful!,"Tried this on today at my local retailer and had to have it. it is so comfortable and flattering. it's too bad the picture online has the model tucking it into the skirt because you can't see the ruching across the front. a little dressier alternative to a plain tee and reasonably priced for retailer. 5'8"""" and i generally wear a 6, the small fit well. will probably be back for the black!"
45,862,Love the two tone design,"I bought this item from online... the fit on the model looked a little loose but when i got mine it seemed a bit tight! so i took it back to the store & ordered a larger size. for the sale price this is a great top."
46,862,,"I love this top. i wear it all the time.  the problem is that you can tell i wear it all the time as the fabric has started to fade.  i'd still recommend it as it is so comfortable."
47,823,,"Very comfortable, material is good, cut out on sleeves flattering"
48,910,Love the color!,"This sweater is perfect for fall...it's roomy, warm, super comfy and the color really pops."
49,862,Love the embroidery!,"Really cute top! the embroidery on the collar & bib of this top is beautiful and unique, received lots of compliments & questions about where i got it. i'm rather busty up top and the medium fit well, a small probably would've fit better but it's still super adorable."
50,862,Cute for fall,"This is a cute top that can transition easily from summer to fall. it fits well, nice print and it's comfortable. i tried this on in the store, but did not purchase it because the color washed me out. this is not the best color for a blonde. would look much better on a brunette. if this was in a different color i most likely would have purchased it."
51,862,Love,"I absolutely love this bib tee! it's probably my favorite retailer purchase of all time. i'm 5'7"", 140 pounds and the small was a perfect fit for me. i typically wear either a s or m tops."
52,1104,,"Love the color and style, but material snags easily"
53,862,Flattering and comfortable,"Very soft and comfortable. the shirt has an unusual, asymmetrical seam that appears along the front, right-hand side of the garment. (the model is positioned so that you can't see this detail from the picture. i attached a picture that includes the front seam.) i actually like the seam - it creates more visual interest, and adds a little bit of ruching that helps hide my belly. the cowl neck is very well done - there are two layers that form the cowl, and i've found that it means wardrobe malfun"
54,862,Cute top,"Nice top. armholes are a bit oversized but as an older woman, i'm picky about that. the print is pretty and unusual. it just didn't look great on me. there's a slight peplum in the back that hangs nicely. it's a lightweight tee fabric that's opaque. i tried it on with a black bra which was barely visible. great for warmer climates but there are so many gorgeous tops out now, that i decided to return since summer is winding down. i do recommend."
55,862,Soft and cute as can be!,"This is an adorable top that i find to be extremely comfortable. i don't usually buy prints but this one is so feminine and looks great with dark wash jeans. i am a 36d and the medium was a perfect fit."
56,368,,"I am pregnant and i thought this would be a great sleep bra. it's soft and fits okay, but it has zero support or shape. i would only buy if you are a b cup or smaller and can get away without support. if i would have seen this is the store, i would have passed over it. however, i was too lazy to return so i am wearing it. it's comfortable so that's a redeeming quality. i would not recommend for larger chested ladies, though!"
57,862,"Boring front, great back","This tank fit well and i loved the ruffle in the back and how it layed. but the front was not a good look and i will be retuning it."
58,1095,,"I got this in the petite length, size o, and it fit just right. i like that i didn't have to have it altered in the length; can wear with flats with plenty of clearance to the floor from the bottom hem. my only beef with the design is the height of the waist. i personally think that the elastic waistband looks cheap, and really needs to be concealed with a belt, yet because it sits so high, literally right under the bustline, it's a tricky one to pull off. i have a wide belt that sort of does th"
59,368,Soft and comfortable,"I've been looking for bralettes that provide some support but not binding/tight for night time and casual wear. this is a light weight bra, could be a little more supportive. pretty color, with nice lines. only downside is the retailer tag on the back - itchy (i need to remove it.)"
60,1095,Gorgeous dress!,"This dress is simply beautiful and stunning. it is so figure flattering and i can't wait to wear it. size small worked for me, and since i'm tall it fell right to my ankle which is perfect for me. i could not be happier with the purchase and the keyhole in the back is a beautiful detail."
61,368,Itchy tags,"3 tags sewn in, 2 small (about 1'' long) and 1 huge (about 2'' x 3''). very itchy so i cut them out. then the thread left behind was plasticy and even more itchy! how can you make an intimates item with such itchy tags? not comfortable at all! also - i love bralettes and wear them all the time including to work. i am a b cup. however, this one is so thin and flimsy that it gives no support even to a b cup - so for me this would only be a lounging bralette - if it wasn't so itchy!"
62,862,Must have,"I recently got this on sale after looking at it forever on my wish list. i'm so happy with it. its very comfortable and just long enough for my torso (5'3). the pattern on the front is very flattering."
63,862,Cute top! love the brand,"Very comfortable shirt, light weight top with lovely floral colors. great for spring/summer with white jeans. love everything one september makes!"
64,862,Love this top,"Loved this top and was really happy to find it on sale!"
65,862,,"Beautiful top, but delicate! i wore it to school and the straps on my backpack caused some pilling. other than that it is beautiful and vibrant! just make sure you aren't doing/wearing anything that will rub it continuously since the fabric is delicate"
66,862,Super cute and unique top,"Just received this in the mail, tried it on and am smitten. i'm usually a l, but sometimes i'm a xl (if no stretch), in retailer tops. i bought this one in l and i'm sure glad i did. very flowy, stretchy and comfortable. i also bought the meda lace top from one september and they are very similar expect this is more of a t-shirt and the other is more of a blouse. i almost think i could've gotten a m in this because there is a lot of extra fabric at the chest which is usually never the issue for me"
67,862,Beautiful top,"Love this top! i kept eyeing it online and wavering on size, since my post-baby body is a little wonky. i went with the xsp, and miraculously, it works perfectly! so, i would say it does run just a little large..... i love the length, and usually do not go with petite sizes at retailer because i like the longer lengths of the regular. but this is perfect on me, and there is give up top, so it looks lovely. and it is very soft and comfortable. this will be a go-to top this season!"
68,862,I wanted to love this top...,"I really loved this top online and wanted to love it in person. it is soft and the patter is okay in person. the neckline is higher than i am used to. also, there are two buttons in the back that must be unbuttoned in order to wear the top. it is difficult to button them behind your neck with the top on. unfortunately i had to return this item..."
69,1078,Great summer fabric!,"I really wanted this to work. alas, it had a strange fit for me. the straps would not stay up, and it had a weird fit under the breast. it worked standing up, but the minute i sat down it fell off my shoulders. the fabric was beautiful! and i loved that it had pockets."
70,845,"Cute, but massive sweep","This top is so cute, but it is massively babydoll shaped (a- line) which is not apparent from the pictures. i measured the xs i have and the chest is about 42"" and sweep is over 70"". i would definitely keep this top if it hung straighter. the craftsmanship is lovely and fabric is so natural and handwoven looking. i'm thinking about asking my tailor if she can take the sides in, but that might ruin it as the fabric layout is cut and proportioned to this swing style."
71,822,Short and boxy,"Why do designers keep making crop tops??!! i can't imagine this would be flattering on anyone, especially someone average height and well endowed on top. i looked like a football player. the pattern and fabric are gorgeous, so if you are like 4' tall and super tiny and can fit xxs this may work? i am between a 6-8 and fit a small and it was huge on me and almost was bigger at the bottom than the top. such a weird cut. there is a cami underneath so if it rides up that will show but that is so 80s"
72,850,Beautiful design,"I have a short torso and this works well for me. 34c, bought the 0. there's not much stretch to the fabric so it is fitted to my chest, but not in an uncomfortable way. definitely doesn't hang and have extra fabric like on the model. zipper goes almost all the way down to the bottom so it's easier to get on and off which makes up for the lack of stretch n the fabric.unlike another reviewer, i found it went really well with navy pants and i wore it to a business meeting under a blazer. wi"
73,866,,"I love this top. it is loose and comfortable. it is not sheer so you don't need a cami. it runs a little large so size down if you want a more tailored fit. 1 criticism, it catches on sharp jewelry or belts and can pull if you are not careful."
74,1081,,"I passed up this dress so many times in the store and finally tried it on today because i wanted a casual dress while traveling in the cape. i was surprised how much cuter it is on than on hanger. i sized down to get a more fitting look and really made a difference for me in style. i was not a fan of the way it looked so loose on model. it looks really cute fitted and a bit sexy even. it is lined and very comfy and can be dressed up a but for work with a cardi. i believe i will get a lot of wear"
75,845,Very very cute but a lot of fabric,"I am so drawn to baby doll and boxy shirts so i immediately tried this on in the store. i am petite and only 5'2"", so usually shirts with a lot of fabric swallow me whole but this one was still cute. there is a lot more fabric than the picture lets on, but i think it is still super cute and flattering. i would definitely check the size chart and read comments to see if someone with your same size description has recommended a specific size for your body type. i am petite and weigh about 110 lbs"
76,1082,Runs large in top and waist,"I would have loved this dress if the bust and waist were just a little more fitted. i am 32c and the top was too big. fit perfectly on hips. the lace material means it cannot be easily altered, so i chose to return the dress. i would have definitely kept it if it were a better fit."
77,850,Zipper broke,"The zipper broke on this piece the first time i wore it. very disappointing since i love the design. i'm actually going to try to replace the zipper myself with something stronger, but annoying that it's come to that."
